artifact_type,path,note
corner_exit_review_csv,research/ufo-video-pr39-corner-exit-review-dod111689057.csv,PR39 ten-fps full-clip lower-corner review table
summary_csv,research/ufo-video-pr39-corner-exit-review-summary.csv,PR39 lower-corner review summary
annotated_contact_sheet,research/ufo-derived/video-motion-pass/pr39-corner-exit-review/DOD_111689057/sheets/DOD_111689057-pr39-annotated_00.jpg,PR39 annotated corner-exit sheet
annotated_contact_sheet,research/ufo-derived/video-motion-pass/pr39-corner-exit-review/DOD_111689057/sheets/DOD_111689057-pr39-annotated_01.jpg,PR39 annotated corner-exit sheet
zoom_patch_contact_sheet,research/ufo-derived/video-motion-pass/pr39-corner-exit-review/DOD_111689057/sheets/DOD_111689057-pr39-patches_00.jpg,PR39 lower-corner patch sheet

